{
  "schemaVersion": 1,
  "candidate": {
    "version": null,
    "build": null,
    "commit": null,
    "artifact": null
  },
  "cases": [
    { "id": "clean.standard.no-old-data", "phase": "cleanInstall", "status": "pending", "evidence": [] },
    { "id": "clean.admin.no-old-data", "phase": "cleanInstall", "status": "pending", "evidence": [] },
    { "id": "clean.old-data-only", "phase": "cleanInstall", "status": "pending", "evidence": [] },
    { "id": "clean.helper-absent", "phase": "cleanInstall", "status": "pending", "evidence": [] },
    { "id": "clean.helper-registered", "phase": "cleanInstall", "status": "pending", "evidence": [] },
    { "id": "clean.cli-absent", "phase": "cleanInstall", "status": "blockedAbsentSurface", "evidence": [] },
    { "id": "clean.cli-broken", "phase": "cleanInstall", "status": "blockedAbsentSurface", "evidence": [] },
    { "id": "clean.factory-core", "phase": "cleanInstall", "status": "pending", "evidence": [] },
    { "id": "clean.no-configuration", "phase": "cleanInstall", "status": "pending", "evidence": [] },
    { "id": "clean.local-configuration", "phase": "cleanInstall", "status": "pending", "evidence": [] },
    { "id": "clean.remote-configuration", "phase": "cleanInstall", "status": "pending", "evidence": [] },
    { "id": "clean.applications-location", "phase": "cleanInstall", "status": "pending", "evidence": [] },
    { "id": "clean.downloads-translocated", "phase": "cleanInstall", "status": "pending", "evidence": [] },
    { "id": "clean.read-only-dmg", "phase": "cleanInstall", "status": "pending", "evidence": [] },

    { "id": "upgrade.fixture-v0.1", "phase": "upgrade", "status": "pending", "evidence": [] },
    { "id": "upgrade.fixture-v0.2", "phase": "upgrade", "status": "pending", "evidence": [] },
    { "id": "upgrade.fixture-v0.3", "phase": "upgrade", "status": "pending", "evidence": [] },
    { "id": "upgrade.fixture-v0.4", "phase": "upgrade", "status": "pending", "evidence": [] },
    { "id": "upgrade.fixture-v0.5", "phase": "upgrade", "status": "pending", "evidence": [] },
    { "id": "upgrade.fixture-v0.6", "phase": "upgrade", "status": "pending", "evidence": [] },
    { "id": "upgrade.fixture-v0.7", "phase": "upgrade", "status": "pending", "evidence": [] },
    { "id": "upgrade.fixture-v0.8", "phase": "upgrade", "status": "pending", "evidence": [] },
    { "id": "upgrade.stable-to-rc", "phase": "upgrade", "status": "pending", "evidence": [] },
    { "id": "upgrade.beta-to-rc", "phase": "upgrade", "status": "pending", "evidence": [] },
    { "id": "upgrade.rc1-to-rc2", "phase": "upgrade", "status": "pending", "evidence": [] },
    { "id": "upgrade.rc-to-1.0", "phase": "upgrade", "status": "pending", "evidence": [] },
    { "id": "upgrade.tun-off", "phase": "upgrade", "status": "pending", "evidence": [] },
    { "id": "upgrade.tun-on", "phase": "upgrade", "status": "pending", "evidence": [] },
    { "id": "upgrade.system-proxy-on", "phase": "upgrade", "status": "pending", "evidence": [] },
    { "id": "upgrade.helper-old", "phase": "upgrade", "status": "pending", "evidence": [] },
    { "id": "upgrade.helper-current", "phase": "upgrade", "status": "pending", "evidence": [] },
    { "id": "upgrade.cli-old", "phase": "upgrade", "status": "blockedAbsentSurface", "evidence": [] },
    { "id": "upgrade.cli-current", "phase": "upgrade", "status": "blockedAbsentSurface", "evidence": [] },
    { "id": "upgrade.external-core-active", "phase": "upgrade", "status": "pending", "evidence": [] },
    { "id": "upgrade.blocked-core", "phase": "upgrade", "status": "pending", "evidence": [] },
    { "id": "upgrade.automatic-scenes", "phase": "upgrade", "status": "blockedAbsentSurface", "evidence": [] },
    { "id": "upgrade.incomplete-journals", "phase": "upgrade", "status": "pending", "evidence": [] },
    { "id": "upgrade.low-disk", "phase": "upgrade", "status": "pending", "evidence": [] },
    { "id": "upgrade.sparkle-offline", "phase": "upgrade", "status": "pending", "evidence": [] },

    { "id": "repair.helper-reinstall", "phase": "repair", "status": "pending", "evidence": [] },
    { "id": "repair.cli", "phase": "repair", "status": "blockedAbsentSurface", "evidence": [] },
    { "id": "repair.support-bundle", "phase": "repair", "status": "pending", "evidence": [] },
    { "id": "repair.safe-mode", "phase": "repair", "status": "pending", "evidence": [] },
    { "id": "repair.profile-restore", "phase": "repair", "status": "pending", "evidence": [] },
    { "id": "repair.update-journal", "phase": "repair", "status": "pending", "evidence": [] },
    { "id": "repair.factory-core-fallback", "phase": "repair", "status": "pending", "evidence": [] },
    { "id": "repair.data-export", "phase": "repair", "status": "pending", "evidence": [] },

    { "id": "uninstall.tun-stop-cleanup", "phase": "uninstall", "status": "pending", "evidence": [] },
    { "id": "uninstall.helper-unregister", "phase": "uninstall", "status": "pending", "evidence": [] },
    { "id": "uninstall.cli-symlink-removal", "phase": "uninstall", "status": "blockedAbsentSurface", "evidence": [] },
    { "id": "uninstall.optional-user-data-removal", "phase": "uninstall", "status": "pending", "evidence": [] },
    { "id": "uninstall.no-unknown-process-network-deletion", "phase": "uninstall", "status": "pending", "evidence": [] },
    { "id": "uninstall.retained-data-policy", "phase": "uninstall", "status": "pending", "evidence": [] },

    { "id": "downgrade.no-silent-downgrade", "phase": "downgrade", "status": "pending", "evidence": [] },
    { "id": "downgrade.manual-previous-stable-schema-guard", "phase": "downgrade", "status": "pending", "evidence": [] },
    { "id": "downgrade.backup-export-instructions", "phase": "downgrade", "status": "pending", "evidence": [] },
    { "id": "downgrade.helper-core-compatibility-warning", "phase": "downgrade", "status": "pending", "evidence": [] },
    { "id": "downgrade.no-write-compatibility-promise", "phase": "downgrade", "status": "pending", "evidence": [] }
  ],
  "decision": "noGo",
  "blockers": [
    "Candidate-bound evidence has not been produced by running the exact matrix on a final signed and notarized DMG.",
    "Production CLI and automatic Scenes are absent public-contract surfaces, so their matrix cases remain blockedAbsentSurface."
  ]
}
